{
  "schema_version": "lerobot-coreai.safety_profile.v0",
  "name": "pusht-sim-default",
  "profile_version": "0.1.0",
  "profile_type": "software_bounds",
  "robot_type": null,
  "action_shape": [2],
  "min_action": null,
  "max_action": null,
  "max_abs_action": 1.0,
  "max_delta": 0.3,
  "max_l2_norm": 1.5,
  "allow_nan": false,
  "allow_inf": false,
  "allow_shape_change": false,
  "clip_to_bounds": false,
  "block_on_clip": false,
  "require_finite": true,
  "require_known_shape": true,
  "require_robot_type_match": false,
  "mode": "fail_closed",
  "intended_envs": ["PushT-v0", "pusht"],
  "intended_modes": ["sim"],
  "description": "Software action-bound profile for PushT-style simulator envs ([2] action).",
  "limitations": [
    "Simulator software profile only.",
    "Does not prove real-world task success.",
    "Does not prove physical safety."
  ]
}
