{
  "schema_version": "lerobot-coreai.safety_profile.v0",
  "name": "generic-7dof-sim-default",
  "profile_version": "0.1.0",
  "profile_type": "software_bounds",
  "robot_type": null,
  "action_shape": [7],
  "min_action": null,
  "max_action": null,
  "max_abs_action": 1.0,
  "max_delta": 0.25,
  "max_l2_norm": 2.5,
  "allow_nan": false,
  "allow_inf": false,
  "allow_shape_change": false,
  "clip_to_bounds": false,
  "block_on_clip": false,
  "require_finite": true,
  "require_known_shape": true,
  "require_robot_type_match": false,
  "mode": "fail_closed",
  "intended_modes": ["sim", "shadow"],
  "description": "Generic 7-DoF software action profile (single [7] action).",
  "limitations": [
    "Generic 7D action software profile.",
    "Not a hardware-certified joint limit profile.",
    "Does not prove physical safety."
  ]
}
