{
  "schema_version": "lerobot-coreai.safety_profile.v0",
  "name": "so101-sim-default",
  "profile_version": "0.1.0",
  "profile_type": "software_bounds",
  "robot_type": "so101",
  "action_shape": [16, 7],
  "min_action": null,
  "max_action": null,
  "max_abs_action": 1.0,
  "max_delta": 0.35,
  "max_l2_norm": 6.0,
  "allow_nan": false,
  "allow_inf": false,
  "allow_shape_change": false,
  "clip_to_bounds": false,
  "block_on_clip": false,
  "require_finite": true,
  "require_known_shape": true,
  "require_robot_type_match": true,
  "mode": "fail_closed",
  "intended_modes": ["sim", "shadow"],
  "intended_policy_types": ["act", "diffusion", "pi0", "pi05", "smolvla", "evo1"],
  "description": "Software action-bound profile for SO-101-family policies in simulator/shadow.",
  "limitations": [
    "Software action-bound profile for simulator/shadow workflows.",
    "Does not prove SO-101 physical safety.",
    "Does not encode torque/current/thermal limits."
  ]
}
